No,;Time;Source;Destination;Protocol;Length;Info;;Time 1;Time 2;Delay;;Delay 1;Delay 2;Jitter
1;0;192,168,43,84;184,72,128,137;TCP;55;56881  >  443 [ACK] Seq=1 Ack=1 Win=64860 Len=1 [TCP segment of a reassembled PDU];;0;0,288997;0,288997;;0,092069;0,196928;0,104859
2;0,288997;184,72,128,137;192,168,43,84;TCP;54;443  >  56881 [ACK] Seq=1 Ack=2 Win=35880 Len=0;;0,288997;0,485925;0,196928;;-0,093542;0,29047;0,384012
3;0,485925;192,168,43,84;34,200,44,32;TCP;66;57199  >  443 [SYN] Seq=0 Win=64240 Len=0 MSS=1460 WS=256 SACK_PERM=1;;0,485925;0,776395;0,29047;;0,290256;0,000214;-0,290042
4;0,776395;34,200,44,32;192,168,43,84;TCP;58;443  >  57199 [SYN, ACK] Seq=0 Ack=1 Win=26883 Len=0 MSS=1380;;0,776395;0,776609;0,000214;;-0,000504;0,000718;0,001222
5;0,776609;192,168,43,84;34,200,44,32;TCP;54;57199  >  443 [ACK] Seq=1 Ack=1 Win=64240 Len=0;;0,776609;0,777327;0,000718;;-0,293823;0,294541;0,588364
6;0,777327;192,168,43,84;34,200,44,32;TLSv1,2;232;Client Hello;;0,777327;1,071868;0,294541;;0,29448;6,10E-05;-0,294419
7;1.071.868;34,200,44,32;192,168,43,84;TCP;54;443  >  57199 [ACK] Seq=1 Ack=179 Win=26800 Len=0;;1,071868;1,071929;6,10E-05;;-0,002357;0,002418;0,004775
8;1.071.929;34,200,44,32;192,168,43,84;TLSv1,2;1354;Server Hello;;1,071929;1,074347;0,002418;;0,002363;5,50E-05;-0,002308
9;1.074.347;34,200,44,32;192,168,43,84;TCP;1354;443  >  57199 [ACK] Seq=1301 Ack=179 Win=26800 Len=1300 [TCP segment of a reassembled PDU];;1,074347;1,074402;5,50E-05;;3,00E-06;5,20E-05;4,90E-05
10;1.074.402;192,168,43,84;34,200,44,32;TCP;54;57199  >  443 [ACK] Seq=179 Ack=2601 Win=64860 Len=0;;1,074402;1,074454;5,20E-05;;-0,001343;0,001395;0,002738
11;1.074.454;34,200,44,32;192,168,43,84;TLSv1,2;906;Certificate, Server Key Exchange, Server Hello Done;;1,074454;1,075849;0,001395;;-0,325366;0,326761;0,652127
12;1.075.849;192,168,43,84;34,200,44,32;TLSv1,2;180;Client Key Exchange, Change Cipher Spec, Encrypted Handshake Message;;1,075849;1,40261;0,326761;;0,325236;0,001525;-0,323711
13;1.402.610;34,200,44,32;192,168,43,84;TLSv1,2;105;Change Cipher Spec, Encrypted Handshake Message;;1,40261;1,404135;0,001525;;0,001154;0,000371;-0,000783
14;1.404.135;192,168,43,84;34,200,44,32;TLSv1,2;343;Application Data;;1,404135;1,404506;0,000371;;-0,298259;0,29863;0,596889
15;1.404.506;192,168,43,84;34,200,44,32;TLSv1,2;976;Application Data;;1,404506;1,703136;0,29863;;0,280677;0,017953;-0,262724
16;1.703.136;34,200,44,32;192,168,43,84;TCP;54;443  >  57199 [ACK] Seq=3504 Ack=1516 Win=29504 Len=0;;1,703136;1,721089;0,017953;;0,017698;0,000255;-0,017443
17;1.721.089;34,200,44,32;192,168,43,84;TLSv1,2;586;Application Data;;1,721089;1,721344;0,000255;;3,00E-06;0,000252;0,000249
18;1.721.344;34,200,44,32;192,168,43,84;TLSv1,2;85;Encrypted Alert;;1,721344;1,721596;0,000252;;7,50E-05;0,000177;0,000102
19;1.721.596;192,168,43,84;34,200,44,32;TLSv1,2;85;Encrypted Alert;;1,721596;1,721773;0,000177;;-0,28965;0,289827;0,579477
20;1.721.773;192,168,43,84;34,200,44,32;TCP;54;57199  >  443 [FIN, ACK] Seq=1547 Ack=4067 Win=64860 Len=0;;1,721773;2,0116;0,289827;;0,280302;0,009525;-0,270777
21;2.011.600;34,200,44,32;192,168,43,84;TCP;54;[TCP Dup ACK 16#1] 443  >  57199 [ACK] Seq=4067 Ack=1516 Win=29504 Len=0;;2,0116;2,021125;0,009525;;0,009443;8,20E-05;-0,009361
22;2.021.125;34,200,44,32;192,168,43,84;TCP;54;443  >  57199 [ACK] Seq=4067 Ack=1548 Win=29504 Len=0;;2,021125;2,021207;8,20E-05;;2,40E-05;5,80E-05;3,40E-05
23;2.021.207;34,200,44,32;192,168,43,84;TCP;54;443  >  57199 [FIN, ACK] Seq=4067 Ack=1548 Win=29504 Len=0;;2,021207;2,021265;5,80E-05;;-0,230573;0,230631;0,461204
24;2.021.265;192,168,43,84;34,200,44,32;TCP;54;57199  >  443 [ACK] Seq=1548 Ack=4068 Win=64860 Len=0;;2,021265;2,251896;0,230631;;0,143414;0,087217;-0,056197
25;2.251.896;192,168,43,84;52,84,229,238;TCP;55;56886  >  443 [ACK] Seq=1 Ack=1 Win=509 Len=1 [TCP segment of a reassembled PDU];;2,251896;2,339113;0,087217;;-0,451979;0,539196;0,991175
26;2.339.113;52,84,229,238;192,168,43,84;TCP;66;443  >  56886 [ACK] Seq=1 Ack=2 Win=123 Len=0 SLE=1 SRE=2;;2,339113;2,878309;0,539196;;0,473361;0,065835;-0,407526
27;2.878.309;192,168,43,84;104.118.106.235;TCP;55;56888  >  443 [ACK] Seq=1 Ack=1 Win=507 Len=1 [TCP segment of a reassembled PDU];;2,878309;2,944144;0,065835;;-1,882826;1,948661;3,831487
28;2.944.144;104.118.106.235;192,168,43,84;TCP;66;443  >  56888 [ACK] Seq=1 Ack=2 Win=254 Len=0 SLE=1 SRE=2;;2,944144;4,892805;1,948661;;1,66294;0,285721;-1,377219
29;4.892.805;192,168,43,84;40,90,137,120;TCP;66;57200  >  443 [SYN] Seq=0 Win=64240 Len=0 MSS=1460 WS=256 SACK_PERM=1;;4,892805;5,178526;0,285721;;0,285575;0,000146;-0,285429
30;5.178.526;40,90,137,120;192,168,43,84;TCP;66;443  >  57200 [SYN, ACK] Seq=0 Ack=1 Win=8192 Len=0 MSS=1380 WS=256 SACK_PERM=1;;5,178526;5,178672;0,000146;;-5,00E-05;0,000196;0,000246
31;5.178.672;192,168,43,84;40,90,137,120;TCP;54;57200  >  443 [ACK] Seq=1 Ack=1 Win=131072 Len=0;;5,178672;5,178868;0,000196;;-0,293864;0,29406;0,587924
32;5.178.868;192,168,43,84;40,90,137,120;TLSv1,2;279;Client Hello;;5,178868;5,472928;0,29406;;0,292872;0,001188;-0,291684
33;5.472.928;40,90,137,120;192,168,43,84;TCP;1434;443  >  57200 [ACK] Seq=1 Ack=226 Win=262144 Len=1380 [TCP segment of a reassembled PDU];;5,472928;5,474116;0,001188;;0,001151;3,70E-05;-0,001114
34;5.474.116;40,90,137,120;192,168,43,84;TCP;1434;443  >  57200 [ACK] Seq=1381 Ack=226 Win=262144 Len=1380 [TCP segment of a reassembled PDU];;5,474116;5,474153;3,70E-05;;-0,00026;0,000297;0,000557
35;5.474.153;192,168,43,84;40,90,137,120;TCP;54;57200  >  443 [ACK] Seq=226 Ack=2761 Win=131072 Len=0;;5,474153;5,47445;0,000297;;-0,001479;0,001776;0,003255
36;5.474.450;40,90,137,120;192,168,43,84;TLSv1,2;1067;Server Hello, Certificate, Certificate Status, Server Key Exchange, Server Hello Done;;5,47445;5,476226;0,001776;;-0,070564;0,07234;0,142904
37;5.476.226;192,168,43,84;40,90,137,120;TLSv1,2;180;Client Key Exchange, Change Cipher Spec, Encrypted Handshake Message;;5,476226;5,548566;0,07234;;-0,155035;0,227375;0,38241
38;5.548.566;52,114,77,164;192,168,43,84;TCP;54;443  >  56981 [RST, ACK] Seq=1 Ack=1 Win=0 Len=0;;5,548566;5,775941;0,227375;;0,227316;5,90E-05;-0,227257
39;5.775.941;40,90,137,120;192,168,43,84;TLSv1,2;105;Change Cipher Spec, Encrypted Handshake Message;;5,775941;5,776;5,90E-05;;1,40E-05;4,50E-05;3,10E-05
40;5.776.000;40,90,137,120;192,168,43,84;TLSv1,2;123;Application Data;;5,776;5,776045;4,50E-05;;-0,000409;0,000454;0,000863
41;5.776.045;192,168,43,84;40,90,137,120;TCP;54;57200  >  443 [ACK] Seq=352 Ack=3894 Win=129792 Len=0;;5,776045;5,776499;0,000454;;0,000392;6,20E-05;-0,00033
42;5.776.499;192,168,43,84;40,90,137,120;TLSv1,2;141;Application Data;;5,776499;5,776561;6,20E-05;;3,30E-05;2,90E-05;-4,00E-06
43;5.776.561;192,168,43,84;40,90,137,120;TLSv1,2;92;Application Data;;5,776561;5,77659;2,90E-05;;-1,80E-05;4,70E-05;6,50E-05
44;5.776.590;192,168,43,84;40,90,137,120;TLSv1,2;315;Application Data;;5,77659;5,776637;4,70E-05;;4,70E-05;0;-4,70E-05
45;5.776.637;192,168,43,84;40,90,137,120;TCP;1434;57200  >  443 [ACK] Seq=738 Ack=3894 Win=129792 Len=1380 [TCP segment of a reassembled PDU];;5,776637;5,776637;0;;0;0;0
46;5.776.637;192,168,43,84;40,90,137,120;TCP;1434;57200  >  443 [ACK] Seq=2118 Ack=3894 Win=129792 Len=1380 [TCP segment of a reassembled PDU];;5,776637;5,776637;0;;0;0;0
47;5.776.637;192,168,43,84;40,90,137,120;TCP;1434;57200  >  443 [ACK] Seq=3498 Ack=3894 Win=129792 Len=1380 [TCP segment of a reassembled PDU];;5,776637;5,776637;0;;-0,281226;0,281226;0,562452
48;5.776.637;192,168,43,84;40,90,137,120;TLSv1,2;728;Application Data;;5,776637;6,057863;0,281226;;0,281139;8,70E-05;-0,281052
49;6.057.863;40,90,137,120;192,168,43,84;TCP;54;443  >  57200 [ACK] Seq=3894 Ack=477 Win=261888 Len=0;;6,057863;6,05795;8,70E-05;;-0,012242;0,012329;0,024571
50;6.057.950;40,90,137,120;192,168,43,84;TLSv1,2;92;Application Data;;6,05795;6,070279;0,012329;;0,010122;0,002207;-0,007915
51;6.070.279;40,90,137,120;192,168,43,84;TCP;54;443  >  57200 [ACK] Seq=3932 Ack=3498 Win=262144 Len=0;;6,070279;6,072486;0,002207;;0,002053;0,000154;-0,001899
52;6.072.486;40,90,137,120;192,168,43,84;TCP;54;443  >  57200 [ACK] Seq=3932 Ack=5552 Win=262144 Len=0;;6,072486;6,07264;0,000154;;0,000154;0;-0,000154
53;6.072.640;40,90,137,120;192,168,43,84;TLSv1,2;164;Application Data, Application Data;;6,07264;6,07264;0;;-8,20E-05;8,20E-05;0,000164
54;6.072.640;40,90,137,120;192,168,43,84;TLSv1,2;96;Application Data;;6,07264;6,072722;8,20E-05;;-0,018274;0,018356;0,03663
55;6.072.722;192,168,43,84;40,90,137,120;TCP;54;57200  >  443 [ACK] Seq=5552 Ack=4084 Win=129536 Len=0;;6,072722;6,091078;0,018356;;0,01701;0,001346;-0,015664
56;6.091.078;40,90,137,120;192,168,43,84;TCP;1434;443  >  57200 [ACK] Seq=4084 Ack=5552 Win=262144 Len=1380 [TCP segment of a reassembled PDU];;6,091078;6,092424;0,001346;;0,001168;0,000178;-0,00099
57;6.092.424;40,90,137,120;192,168,43,84;TCP;8334;443  >  57200 [ACK] Seq=5464 Ack=5552 Win=262144 Len=8280 [TCP segment of a reassembled PDU];;6,092424;6,092602;0,000178;;-0,004396;0,004574;0,00897
58;6.092.602;192,168,43,84;40,90,137,120;TCP;54;57200  >  443 [ACK] Seq=5552 Ack=13744 Win=131072 Len=0;;6,092602;6,097176;0,004574;;0,004441;0,000133;-0,004308
59;6.097.176;40,90,137,120;192,168,43,84;TCP;1434;443  >  57200 [ACK] Seq=13744 Ack=5552 Win=262144 Len=1380 [TCP segment of a reassembled PDU];;6,097176;6,097309;0,000133;;-2,40E-05;0,000157;0,000181
60;6.097.309;192,168,43,84;40,90,137,120;TCP;54;57200  >  443 [ACK] Seq=5552 Ack=15124 Win=131072 Len=0;;6,097309;6,097466;0,000157;;0,000157;0;-0,000157
61;6.097.466;40,90,137,120;192,168,43,84;TLSv1,2;554;Application Data;;6,097466;6,097466;0;;-8,80E-05;8,80E-05;0,000176
62;6.097.466;40,90,137,120;192,168,43,84;TLSv1,2;92;Application Data;;6,097466;6,097554;8,80E-05;;-0,0785;0,078588;0,157088
63;6.097.554;192,168,43,84;40,90,137,120;TCP;54;57200  >  443 [ACK] Seq=5552 Ack=15662 Win=130560 Len=0;;6,097554;6,176142;0,078588;;-0,211081;0,289669;0,50075
64;6.176.142;192,168,43,84;184,72,128,137;TCP;55;56880  >  443 [ACK] Seq=1 Ack=1 Win=64666 Len=1 [TCP segment of a reassembled PDU];;6,176142;6,465811;0,289669;;0,289669;0;-0,289669
65;6.465.811;192,168,43,84;20,189,123,78;TCP;1434;57186  >  443 [ACK] Seq=1 Ack=1 Win=1022 Len=1380 [TCP segment of a reassembled PDU];;6,465811;6,465811;0;;-0,018255;0,018255;0,03651
66;6.465.811;192,168,43,84;20,189,123,78;TLSv1,2;659;Application Data;;6,465811;6,484066;0,018255;;-0,077311;0,095566;0,172877
67;6.484.066;184,72,128,137;192,168,43,84;TCP;54;443  >  56880 [ACK] Seq=1 Ack=2 Win=35880 Len=0;;6,484066;6,579632;0,095566;;0,012145;0,083421;0,071276
68;6.579.632;20,189,123,78;192,168,43,84;TCP;54;443  >  57186 [ACK] Seq=1 Ack=1986 Win=1024 Len=0;;6,579632;6,663053;0,083421;;0,083356;6,50E-05;-0,083291
69;6.663.053;20,189,123,78;192,168,43,84;TCP;1434;443  >  57186 [ACK] Seq=1 Ack=1986 Win=1024 Len=1380 [TCP segment of a reassembled PDU];;6,663053;6,663118;6,50E-05;;-0,015405;0,01547;0,030875
70;6.663.118;192,168,43,84;20,189,123,78;TCP;54;57186  >  443 [ACK] Seq=1986 Ack=1381 Win=1024 Len=0;;6,663118;6,678588;0,01547;;0,015397;7,30E-05;-0,015324
71;6.678.588;20,189,123,78;192,168,43,84;TCP;1434;443  >  57186 [ACK] Seq=1381 Ack=1986 Win=1024 Len=1380 [TCP segment of a reassembled PDU];;6,678588;6,678661;7,30E-05;;-0,000609;0,000682;0,001291
72;6.678.661;192,168,43,84;20,189,123,78;TCP;54;57186  >  443 [ACK] Seq=1986 Ack=2761 Win=1024 Len=0;;6,678661;6,679343;0,000682;;0,000682;0;-0,000682
73;6.679.343;20,189,123,78;192,168,43,84;TCP;4194;443  >  57186 [ACK] Seq=2761 Ack=1986 Win=1024 Len=4140 [TCP segment of a reassembled PDU];;6,679343;6,679343;0;;0;0;0
74;6.679.343;20,189,123,78;192,168,43,84;TLSv1,2;529;Application Data;;6,679343;6,679343;0;;-8,80E-05;8,80E-05;0,000176
75;6.679.343;20,189,123,78;192,168,43,84;TLSv1,2;92;Application Data;;6,679343;6,679431;8,80E-05;;-0,554025;0,554113;1,108138
76;6.679.431;192,168,43,84;20,189,123,78;TCP;54;57186  >  443 [ACK] Seq=1986 Ack=7414 Win=1024 Len=0;;6,679431;7,233544;0,554113;;0,554065;4,80E-05;-0,554017
77;7.233.544;192,168,43,84;104.118.106.235;TCP;55;56892  >  443 [ACK] Seq=1 Ack=1 Win=512 Len=1 [TCP segment of a reassembled PDU];;7,233544;7,233592;4,80E-05;;-0,062432;0,06248;0,124912
78;7.233.592;192,168,43,84;104.118.106.235;TCP;55;56891  >  443 [ACK] Seq=1 Ack=1 Win=506 Len=1 [TCP segment of a reassembled PDU];;7,233592;7,296072;0,06248;;0,062363;0,000117;-0,062246
79;7.296.072;104.118.106.235;192,168,43,84;TCP;66;443  >  56892 [ACK] Seq=1 Ack=2 Win=254 Len=0 SLE=1 SRE=2;;7,296072;7,296189;0,000117;;-0,216883;0,217;0,433883
80;7.296.189;104.118.106.235;192,168,43,84;TCP;66;443  >  56891 [ACK] Seq=1 Ack=2 Win=254 Len=0 SLE=1 SRE=2;;7,296189;7,513189;0,217;;0,155491;0,061509;-0,093982
81;7.513.189;192,168,43,84;104.118.106.235;TCP;55;56889  >  443 [ACK] Seq=1 Ack=1 Win=512 Len=1 [TCP segment of a reassembled PDU];;7,513189;7,574698;0,061509;;-0,681303;0,742812;1,424115
82;7.574.698;104.118.106.235;192,168,43,84;TCP;66;443  >  56889 [ACK] Seq=1 Ack=2 Win=262 Len=0 SLE=1 SRE=2;;7,574698;8,31751;0,742812;;0,680264;0,062548;-0,617716
83;8.317.510;192,168,43,84;104.118.106.235;TCP;55;56890  >  443 [ACK] Seq=1 Ack=1 Win=512 Len=1 [TCP segment of a reassembled PDU];;8,31751;8,380058;0,062548;;-1,847495;1,910043;3,757538
84;8.380.058;104.118.106.235;192,168,43,84;TCP;66;443  >  56890 [ACK] Seq=1 Ack=2 Win=254 Len=0 SLE=1 SRE=2;;8,380058;10,290101;1,910043;;1,615593;0,29445;-1,321143
87;10.290.101;192,168,43,84;184,72,128,137;TCP;55;[TCP Keep-Alive] 56881  >  443 [ACK] Seq=1 Ack=1 Win=64860 Len=1;;10,290101;10,584551;0,29445;;-0,314521;0,608971;0,923492
88;10.584.551;184,72,128,137;192,168,43,84;TCP;54;[TCP Keep-Alive ACK] 443  >  56881 [ACK] Seq=1 Ack=2 Win=35880 Len=0;;10,584551;11,193522;0,608971;;0,533116;0,075855;-0,457261
89;11.193.522;192,168,43,84;104.118.106.159;TLSv1,2;233;Application Data;;11,193522;11,269377;0,075855;;0,074567;0,001288;-0,073279
90;11.269.377;104.118.106.159;192,168,43,84;TCP;1434;443  >  57193 [ACK] Seq=1 Ack=180 Win=262 Len=1380 [TCP segment of a reassembled PDU];;11,269377;11,270665;0,001288;;0,001197;9,10E-05;-0,001106
91;11.270.665;104.118.106.159;192,168,43,84;TCP;1434;443  >  57193 [ACK] Seq=1381 Ack=180 Win=262 Len=1380 [TCP segment of a reassembled PDU];;11,270665;11,270756;9,10E-05;;-0,000242;0,000333;0,000575
92;11.270.756;192,168,43,84;104.118.106.159;TCP;54;57193  >  443 [ACK] Seq=180 Ack=2761 Win=512 Len=0;;11,270756;11,271089;0,000333;;0,000333;0;-0,000333
93;11.271.089;104.118.106.159;192,168,43,84;TCP;1434;443  >  57193 [ACK] Seq=2761 Ack=180 Win=262 Len=1380 [TCP segment of a reassembled PDU];;11,271089;11,271089;0;;-0,000118;0,000118;0,000236
94;11.271.089;104.118.106.159;192,168,43,84;TLSv1,2;1337;Application Data;;11,271089;11,271207;0,000118;;-0,022214;0,022332;0,044546
95;11.271.207;192,168,43,84;104.118.106.159;TCP;54;57193  >  443 [ACK] Seq=180 Ack=5424 Win=512 Len=0;;11,271207;11,293539;0,022332;;-0,046268;0,0686;0,114868
96;11.293.539;192,168,43,84;104.118.106.159;TLSv1,2;232;Application Data;;11,293539;11,362139;0,0686;;0,052627;0,015973;-0,036654
97;11.362.139;104.118.106.159;192,168,43,84;TLSv1,2;1229;Application Data;;11,362139;11,378112;0,015973;;-0,064433;0,080406;0,144839
98;11.378.112;192,168,43,84;104.118.106.159;TLSv1,2;242;Application Data;;11,378112;11,458518;0,080406;;0,079871;0,000535;-0,079336
99;11.458.518;104.118.106.159;192,168,43,84;TCP;1434;443  >  57193 [ACK] Seq=6599 Ack=546 Win=279 Len=1380 [TCP segment of a reassembled PDU];;11,458518;11,459053;0,000535;;0,000511;2,40E-05;-0,000487
100;11.459.053;104.118.106.159;192,168,43,84;TCP;2814;443  >  57193 [ACK] Seq=7979 Ack=546 Win=279 Len=2760 [TCP segment of a reassembled PDU];;11,459053;11,459077;2,40E-05;;-0,00249;0,002514;0,005004
101;11.459.077;192,168,43,84;104.118.106.159;TCP;54;57193  >  443 [ACK] Seq=546 Ack=10739 Win=512 Len=0;;11,459077;11,461591;0,002514;;0,002482;3,20E-05;-0,00245
102;11.461.591;104.118.106.159;192,168,43,84;TCP;1434;443  >  57193 [ACK] Seq=10739 Ack=546 Win=279 Len=1380 [TCP segment of a reassembled PDU];;11,461591;11,461623;3,20E-05;;-0,000913;0,000945;0,001858
103;11.461.623;192,168,43,84;104.118.106.159;TCP;54;57193  >  443 [ACK] Seq=546 Ack=12119 Win=512 Len=0;;11,461623;11,462568;0,000945;;0,00092;2,50E-05;-0,000895
104;11.462.568;104.118.106.159;192,168,43,84;TCP;6954;443  >  57193 [ACK] Seq=12119 Ack=546 Win=279 Len=6900 [TCP segment of a reassembled PDU];;11,462568;11,462593;2,50E-05;;-0,000964;0,000989;0,001953
105;11.462.593;192,168,43,84;104.118.106.159;TCP;54;57193  >  443 [ACK] Seq=546 Ack=19019 Win=512 Len=0;;11,462593;11,463582;0,000989;;0,000989;0;-0,000989
106;11.463.582;104.118.106.159;192,168,43,84;TLSv1,2;6954;Application Data [TCP segment of a reassembled PDU];;11,463582;11,463582;0;;-3,70E-05;3,70E-05;7,40E-05
107;11.463.582;104.118.106.159;192,168,43,84;TLSv1,2;70;Application Data;;11,463582;11,463619;3,70E-05;;-0,012196;0,012233;0,024429
108;11.463.619;192,168,43,84;104.118.106.159;TCP;54;57193  >  443 [ACK] Seq=546 Ack=25935 Win=512 Len=0;;11,463619;11,475852;0,012233;;-0,056743;0,068976;0,125719
109;11.475.852;192,168,43,84;104.118.106.159;TLSv1,2;246;Application Data;;11,475852;11,544828;0,068976;;0,068899;7,70E-05;-0,068822
110;11.544.828;104.118.106.159;192,168,43,84;TCP;1434;443  >  57193 [ACK] Seq=25935 Ack=738 Win=287 Len=1380 [TCP segment of a reassembled PDU];;11,544828;11,544905;7,70E-05;;3,40E-05;4,30E-05;9,00E-06
111;11.544.905;104.118.106.159;192,168,43,84;TLSv1,2;365;Application Data;;11,544905;11,544948;4,30E-05;;-0,00989;0,009933;0,019823
112;11.544.948;192,168,43,84;104.118.106.159;TCP;54;57193  >  443 [ACK] Seq=738 Ack=27626 Win=512 Len=0;;11,544948;11,554881;0,009933;;-0,063017;0,07295;0,135967
113;11.554.881;192,168,43,84;104.118.106.159;TLSv1,2;235;Application Data;;11,554881;11,627831;0,07295;;0,072028;0,000922;-0,071106
114;11.627.831;104.118.106.159;192,168,43,84;TCP;1434;443  >  57193 [ACK] Seq=27626 Ack=919 Win=296 Len=1380 [TCP segment of a reassembled PDU];;11,627831;11,628753;0,000922;;0,000847;7,50E-05;-0,000772
115;11.628.753;104.118.106.159;192,168,43,84;TCP;4194;443  >  57193 [ACK] Seq=29006 Ack=919 Win=296 Len=4140 [TCP segment of a reassembled PDU];;11,628753;11,628828;7,50E-05;;-7,00E-06;8,20E-05;8,90E-05
116;11.628.828;192,168,43,84;104.118.106.159;TCP;54;57193  >  443 [ACK] Seq=919 Ack=33146 Win=512 Len=0;;11,628828;11,62891;8,20E-05;;-0,002321;0,002403;0,004724
117;11.628.910;104.118.106.159;192,168,43,84;TCP;1434;443  >  57193 [ACK] Seq=33146 Ack=919 Win=296 Len=1380 [TCP segment of a reassembled PDU];;11,62891;11,631313;0,002403;;0,002329;7,40E-05;-0,002255
118;11.631.313;104.118.106.159;192,168,43,84;TCP;1434;443  >  57193 [ACK] Seq=34526 Ack=919 Win=296 Len=1380 [TCP segment of a reassembled PDU];;11,631313;11,631387;7,40E-05;;-0,017396;0,01747;0,034866
119;11.631.387;192,168,43,84;104.118.106.159;TCP;54;57193  >  443 [ACK] Seq=919 Ack=35906 Win=512 Len=0;;11,631387;11,648857;0,01747;;0,016409;0,001061;-0,015348
120;11.648.857;104.118.106.159;192,168,43,84;TCP;1434;443  >  57193 [ACK] Seq=35906 Ack=919 Win=296 Len=1380 [TCP segment of a reassembled PDU];;11,648857;11,649918;0,001061;;0,000974;8,70E-05;-0,000887
121;11.649.918;104.118.106.159;192,168,43,84;TLSv1,2;9714;Application Data [TCP segment of a reassembled PDU];;11,649918;11,650005;8,70E-05;;-0,000607;0,000694;0,001301
122;11.650.005;192,168,43,84;104.118.106.159;TCP;54;57193  >  443 [ACK] Seq=919 Ack=46946 Win=512 Len=0;;11,650005;11,650699;0,000694;;0,00062;7,40E-05;-0,000546
123;11.650.699;104.118.106.159;192,168,43,84;TCP;4194;443  >  57193 [ACK] Seq=46946 Ack=919 Win=296 Len=4140 [TCP segment of a reassembled PDU];;11,650699;11,650773;7,40E-05;;-0,002664;0,002738;0,005402
124;11.650.773;192,168,43,84;104.118.106.159;TCP;54;57193  >  443 [ACK] Seq=919 Ack=51086 Win=512 Len=0;;11,650773;11,653511;0,002738;;0,002655;8,30E-05;-0,002572
125;11.653.511;104.118.106.159;192,168,43,84;TCP;1434;443  >  57193 [ACK] Seq=51086 Ack=919 Win=296 Len=1380 [TCP segment of a reassembled PDU];;11,653511;11,653594;8,30E-05;;-0,00022;0,000303;0,000523
126;11.653.594;192,168,43,84;104.118.106.159;TCP;54;57193  >  443 [ACK] Seq=919 Ack=52466 Win=512 Len=0;;11,653594;11,653897;0,000303;;0,000303;0;-0,000303
127;11.653.897;104.118.106.159;192,168,43,84;TLSv1,2;2814;Application Data [TCP segment of a reassembled PDU];;11,653897;11,653897;0;;-8,30E-05;8,30E-05;0,000166
128;11.653.897;104.118.106.159;192,168,43,84;TLSv1,2;104;Application Data;;11,653897;11,65398;8,30E-05;;-0,023965;0,024048;0,048013
129;11.653.980;192,168,43,84;104.118.106.159;TCP;54;57193  >  443 [ACK] Seq=919 Ack=55276 Win=512 Len=0;;11,65398;11,678028;0,024048;;-0,040876;0,064924;0,1058
130;11.678.028;192,168,43,84;104.118.106.159;TLSv1,2;226;Application Data;;11,678028;11,742952;0,064924;;0,064404;0,00052;-0,063884
131;11.742.952;104.118.106.159;192,168,43,84;TCP;1434;443  >  57193 [ACK] Seq=55276 Ack=1091 Win=304 Len=1380 [TCP segment of a reassembled PDU];;11,742952;11,743472;0,00052;;0,000486;3,40E-05;-0,000452
132;11.743.472;104.118.106.159;192,168,43,84;TCP;2814;443  >  57193 [ACK] Seq=56656 Ack=1091 Win=304 Len=2760 [TCP segment of a reassembled PDU];;11,743472;11,743506;3,40E-05;;-0,001399;0,001433;0,002832
133;11.743.506;192,168,43,84;104.118.106.159;TCP;54;57193  >  443 [ACK] Seq=1091 Ack=59416 Win=512 Len=0;;11,743506;11,744939;0,001433;;0,001388;4,50E-05;-0,001343
134;11.744.939;104.118.106.159;192,168,43,84;TCP;1434;443  >  57193 [ACK] Seq=59416 Ack=1091 Win=304 Len=1380 [TCP segment of a reassembled PDU];;11,744939;11,744984;4,50E-05;;-3,00E-06;4,80E-05;5,10E-05
135;11.744.984;192,168,43,84;104.118.106.159;TCP;54;57193  >  443 [ACK] Seq=1091 Ack=60796 Win=512 Len=0;;11,744984;11,745032;4,80E-05;;-0,040168;0,040216;0,080384
136;11.745.032;104.118.106.159;192,168,43,84;TLSv1,2;305;Application Data;;11,745032;11,785248;0,040216;;-0,513896;0,554112;1,068008
137;11.785.248;192,168,43,84;104.118.106.159;TCP;54;57193  >  443 [ACK] Seq=1091 Ack=61047 Win=511 Len=0;;11,785248;12,33936;0,554112;;0,501928;0,052184;-0,449744
138;12.339.360;192,168,43,84;52,84,229,238;TCP;55;[TCP Keep-Alive] 56886  >  443 [ACK] Seq=1 Ack=1 Win=509 Len=1;;12,33936;12,391544;0,052184;;-0,469924;0,522108;0,992032
139;12.391.544;52,84,229,238;192,168,43,84;TCP;66;[TCP Keep-Alive ACK] 443  >  56886 [ACK] Seq=1 Ack=2 Win=123 Len=0 SLE=1 SRE=2;;12,391544;12,913652;0,522108;;0,491443;0,030665;-0,460778
142;12.913.652;192,168,43,84;161,69,38,37;TCP;66;57201  >  443 [SYN] Seq=0 Win=64240 Len=0 MSS=1460 WS=256 SACK_PERM=1;;12,913652;12,944317;0,030665;;-0,028706;0,059371;0,088077
143;12.944.317;192,168,43,84;104.118.106.235;TCP;55;[TCP Keep-Alive] 56888  >  443 [ACK] Seq=1 Ack=1 Win=507 Len=1;;12,944317;13,003688;0,059371;;-0,105779;0,16515;0,270929
144;13.003.688;104.118.106.235;192,168,43,84;TCP;66;[TCP Keep-Alive ACK] 443  >  56888 [ACK] Seq=1 Ack=2 Win=254 Len=0 SLE=1 SRE=2;;13,003688;13,168838;0,16515;;0,164999;0,000151;-0,164848
145;13.168.838;161,69,38,37;192,168,43,84;TCP;66;443  >  57201 [SYN, ACK] Seq=0 Ack=1 Win=65535 Len=0 MSS=1380 WS=1024 SACK_PERM=1;;13,168838;13,168989;0,000151;;-0,001798;0,001949;0,003747
146;13.168.989;192,168,43,84;161,69,38,37;TCP;54;57201  >  443 [ACK] Seq=1 Ack=1 Win=131072 Len=0;;13,168989;13,170938;0,001949;;-0,005063;0,007012;0,012075
147;13.170.938;192,168,43,84;161,69,38,37;TLSv1,2;246;Client Hello;;13,170938;13,17795;0,007012;;-0,055672;0,062684;0,118356
148;13.177.950;192,168,43,84;104,215,197,41;TCP;54;57184  >  443 [FIN, ACK] Seq=1 Ack=1 Win=508 Len=0;;13,17795;13,240634;0,062684;;0,062499;0,000185;-0,062314
149;13.240.634;104,215,197,41;192,168,43,84;TCP;54;443  >  57184 [FIN, ACK] Seq=1 Ack=2 Win=1024 Len=0;;13,240634;13,240819;0,000185;;-0,19019;0,190375;0,380565
150;13.240.819;192,168,43,84;104,215,197,41;TCP;54;57184  >  443 [ACK] Seq=2 Ack=2 Win=508 Len=0;;13,240819;13,431194;0,190375;;0,188828;0,001547;-0,187281
151;13.431.194;161,69,38,37;192,168,43,84;TCP;54;443  >  57201 [ACK] Seq=1 Ack=193 Win=64512 Len=0;;13,431194;13,432741;0,001547;;0,000971;0,000576;-0,000395
152;13.432.741;161,69,38,37;192,168,43,84;TLSv1,2;1434;Server Hello;;13,432741;13,433317;0,000576;;0,000576;0;-0,000576
153;13.433.317;161,69,38,37;192,168,43,84;TCP;1434;443  >  57201 [ACK] Seq=1381 Ack=193 Win=64512 Len=1380 [TCP segment of a reassembled PDU];;13,433317;13,433317;0;;0;0;0
154;13.433.317;161,69,38,37;192,168,43,84;TCP;1390;443  >  57201 [PSH, ACK] Seq=2761 Ack=193 Win=64512 Len=1336 [TCP segment of a reassembled PDU];;13,433317;13,433317;0;;-0,000221;0,000221;0,000442
155;13.433.317;161,69,38,37;192,168,43,84;TLSv1,2;874;Certificate, Server Key Exchange, Server Hello Done;;13,433317;13,433538;0,000221;;-0,006938;0,007159;0,014097
156;13.433.538;192,168,43,84;161,69,38,37;TCP;54;57201  >  443 [ACK] Seq=193 Ack=4917 Win=131072 Len=0;;13,433538;13,440697;0,007159;;-0,25057;0,257729;0,508299
157;13.440.697;192,168,43,84;161,69,38,37;TLSv1,2;180;Client Key Exchange, Change Cipher Spec, Encrypted Handshake Message;;13,440697;13,698426;0,257729;;0,257659;7,00E-05;-0,257589
158;13.698.426;161,69,38,37;192,168,43,84;TCP;54;443  >  57201 [ACK] Seq=4917 Ack=319 Win=64512 Len=0;;13,698426;13,698496;7,00E-05;;-0,002957;0,003027;0,005984
159;13.698.496;161,69,38,37;192,168,43,84;TLSv1,2;328;New Session Ticket, Change Cipher Spec, Encrypted Handshake Message;;13,698496;13,701523;0,003027;;0,002752;0,000275;-0,002477
160;13.701.523;192,168,43,84;161,69,38,37;TLSv1,2;424;Application Data;;13,701523;13,701798;0,000275;;0,000275;0;-0,000275
161;13.701.798;192,168,43,84;161,69,38,37;TCP;1434;57201  >  443 [ACK] Seq=689 Ack=5191 Win=130816 Len=1380 [TCP segment of a reassembled PDU];;13,701798;13,701798;0;;0;0;0
162;13.701.798;192,168,43,84;161,69,38,37;TCP;1434;57201  >  443 [ACK] Seq=2069 Ack=5191 Win=130816 Len=1380 [TCP segment of a reassembled PDU];;13,701798;13,701798;0;;-0,267256;0,267256;0,534512
163;13.701.798;192,168,43,84;161,69,38,37;TLSv1,2;519;Application Data;;13,701798;13,969054;0,267256;;0,267195;6,10E-05;-0,267134
164;13.969.054;161,69,38,37;192,168,43,84;TCP;54;443  >  57201 [ACK] Seq=5191 Ack=689 Win=64512 Len=0;;13,969054;13,969115;6,10E-05;;6,10E-05;0;-6,10E-05
165;13.969.115;161,69,38,37;192,168,43,84;TCP;54;443  >  57201 [ACK] Seq=5191 Ack=2069 Win=62464 Len=0;;13,969115;13,969115;0;;0;0;0
166;13.969.115;161,69,38,37;192,168,43,84;TCP;54;443  >  57201 [ACK] Seq=5191 Ack=3449 Win=61440 Len=0;;13,969115;13,969115;0;;-3,20E-05;3,20E-05;6,40E-05
167;13.969.115;161,69,38,37;192,168,43,84;TCP;54;443  >  57201 [ACK] Seq=5191 Ack=3914 Win=61440 Len=0;;13,969115;13,969147;3,20E-05;;3,20E-05;0;-3,20E-05
168;13.969.147;161,69,38,37;192,168,43,84;TLSv1,2;274;Application Data;;13,969147;13,969147;0;;-4,80E-05;4,80E-05;9,60E-05
169;13.969.147;161,69,38,37;192,168,43,84;TLSv1,2;217;Application Data;;13,969147;13,969195;4,80E-05;;-0,001823;0,001871;0,003694
170;13.969.195;192,168,43,84;161,69,38,37;TCP;54;57201  >  443 [ACK] Seq=3914 Ack=5574 Win=130304 Len=0;;13,969195;13,971066;0,001871;;-0,038705;0,040576;0,079281
171;13.971.066;161,69,38,37;192,168,43,84;TLSv1,2;136;Application Data;;13,971066;14,011642;0,040576;;-0,027441;0,068017;0,095458
173;14.011.642;192,168,43,84;161,69,38,37;TCP;54;57201  >  443 [ACK] Seq=3914 Ack=5656 Win=130304 Len=0;;14,011642;14,079659;0,068017;;-0,194351;0,262368;0,456719
176;14.079.659;192,168,43,84;161,69,38,82;TCP;66;57202  >  443 [SYN] Seq=0 Win=64240 Len=0 MSS=1460 WS=256 SACK_PERM=1;;14,079659;14,342027;0,262368;;0,262048;0,00032;-0,261728
177;14.342.027;161,69,38,82;192,168,43,84;TCP;66;443  >  57202 [SYN, ACK] Seq=0 Ack=1 Win=65535 Len=0 MSS=1380 WS=1024 SACK_PERM=1;;14,342027;14,342347;0,00032;;-0,000552;0,000872;0,001424
178;14.342.347;192,168,43,84;161,69,38,82;TCP;54;57202  >  443 [ACK] Seq=1 Ack=1 Win=131072 Len=0;;14,342347;14,343219;0,000872;;-0,280398;0,28127;0,561668
179;14.343.219;192,168,43,84;161,69,38,82;TLSv1,2;256;Client Hello;;14,343219;14,624489;0,28127;;0,252824;0,028446;-0,224378
180;14.624.489;161,69,38,82;192,168,43,84;TCP;54;443  >  57202 [ACK] Seq=1 Ack=203 Win=64512 Len=0;;14,624489;14,652935;0,028446;;0,028241;0,000205;-0,028036
181;14.652.935;161,69,38,82;192,168,43,84;TLSv1,2;2814;Server Hello;;14,652935;14,65314;0,000205;;-0,006329;0,006534;0,012863
182;14.653.140;192,168,43,84;161,69,38,82;TCP;54;57202  >  443 [ACK] Seq=203 Ack=2761 Win=131072 Len=0;;14,65314;14,659674;0,006534;;0,006271;0,000263;-0,006008
183;14.659.674;161,69,38,82;192,168,43,84;TCP;1390;443  >  57202 [PSH, ACK] Seq=2761 Ack=203 Win=64512 Len=1336 [TCP segment of a reassembled PDU];;14,659674;14,659937;0,000263;;0,000226;3,70E-05;-0,000189
184;14.659.937;161,69,38,82;192,168,43,84;TLSv1,2;874;Certificate, Server Key Exchange, Server Hello Done;;14,659937;14,659974;3,70E-05;;-0,002011;0,002048;0,004059
185;14.659.974;192,168,43,84;161,69,38,82;TCP;54;57202  >  443 [ACK] Seq=203 Ack=4917 Win=131072 Len=0;;14,659974;14,662022;0,002048;;-0,269576;0,271624;0,5412
186;14.662.022;192,168,43,84;161,69,38,82;TLSv1,2;180;Client Key Exchange, Change Cipher Spec, Encrypted Handshake Message;;14,662022;14,933646;0,271624;;0,271426;0,000198;-0,271228
187;14.933.646;161,69,38,82;192,168,43,84;TCP;54;443  >  57202 [ACK] Seq=4917 Ack=329 Win=64512 Len=0;;14,933646;14,933844;0,000198;;-0,028714;0,028912;0,057626
188;14.933.844;161,69,38,82;192,168,43,84;TLSv1,2;344;New Session Ticket, Change Cipher Spec, Encrypted Handshake Message;;14,933844;14,962756;0,028912;;0,028708;0,000204;-0,028504
189;14.962.756;192,168,43,84;161,69,38,82;TLSv1,2;434;Application Data;;14,962756;14,96296;0,000204;;0,000204;0;-0,000204
190;14.962.960;192,168,43,84;161,69,38,82;TCP;1434;57202  >  443 [ACK] Seq=709 Ack=5207 Win=130560 Len=1380 [TCP segment of a reassembled PDU];;14,96296;14,96296;0;;0;0;0
191;14.962.960;192,168,43,84;161,69,38,82;TCP;1434;57202  >  443 [ACK] Seq=2089 Ack=5207 Win=130560 Len=1380 [TCP segment of a reassembled PDU];;14,96296;14,96296;0;;-0,182425;0,182425;0,36485
192;14.962.960;192,168,43,84;161,69,38,82;TLSv1,2;519;Application Data;;14,96296;15,145385;0,182425;;0,098436;0,083989;-0,014447
195;15.145.385;192,168,43,84;23,36,252,159;TCP;66;57203  >  443 [SYN] Seq=0 Win=64240 Len=0 MSS=1460 WS=256 SACK_PERM=1;;15,145385;15,229374;0,083989;;0,083911;7,80E-05;-0,083833
196;15.229.374;23,36,252,159;192,168,43,84;TCP;66;443  >  57203 [SYN, ACK] Seq=0 Ack=1 Win=29200 Len=0 MSS=1380 SACK_PERM=1 WS=128;;15,229374;15,229452;7,80E-05;;-0,000197;0,000275;0,000472
197;15.229.452;192,168,43,84;23,36,252,159;TCP;54;57203  >  443 [ACK] Seq=1 Ack=1 Win=131072 Len=0;;15,229452;15,229727;0,000275;;-0,014893;0,015168;0,030061
198;15.229.727;192,168,43,84;23,36,252,159;TLSv1,2;248;Client Hello;;15,229727;15,244895;0,015168;;0,014974;0,000194;-0,01478
199;15.244.895;161,69,38,82;192,168,43,84;TCP;54;443  >  57202 [ACK] Seq=5207 Ack=709 Win=64512 Len=0;;15,244895;15,245089;0,000194;;0,000194;0;-0,000194
200;15.245.089;161,69,38,82;192,168,43,84;TCP;54;443  >  57202 [ACK] Seq=5207 Ack=2089 Win=62464 Len=0;;15,245089;15,245089;0;;-0,008736;0,008736;0,017472
201;15.245.089;161,69,38,82;192,168,43,84;TCP;54;443  >  57202 [ACK] Seq=5207 Ack=3469 Win=61440 Len=0;;15,245089;15,253825;0,008736;;0,003487;0,005249;0,001762
202;15.253.825;161,69,38,82;192,168,43,84;TCP;54;443  >  57202 [ACK] Seq=5207 Ack=3934 Win=61440 Len=0;;15,253825;15,259074;0,005249;;0,005146;0,000103;-0,005043
203;15.259.074;52.201.200.142;192,168,43,84;TLSv1,2;85;Encrypted Alert;;15,259074;15,259177;0,000103;;6,90E-05;3,40E-05;-3,50E-05
204;15.259.177;52.201.200.142;192,168,43,84;TCP;54;443  >  57189 [FIN, ACK] Seq=32 Ack=1 Win=137 Len=0;;15,259177;15,259211;3,40E-05;;-0,013799;0,013833;0,027632
205;15.259.211;192,168,43,84;52.201.200.142;TCP;54;57189  >  443 [ACK] Seq=1 Ack=33 Win=510 Len=0;;15,259211;15,273044;0,013833;;0,003791;0,010042;0,006251
206;15.273.044;161,69,38,82;192,168,43,84;TLSv1,2;290;Application Data;;15,273044;15,283086;0,010042;;0,009969;7,30E-05;-0,009896
207;15.283.086;161,69,38,82;192,168,43,84;TLSv1,2;99;Application Data;;15,283086;15,283159;7,30E-05;;-0,048789;0,048862;0,097651
208;15.283.159;192,168,43,84;161,69,38,82;TCP;54;57202  >  443 [ACK] Seq=3934 Ack=5488 Win=130304 Len=0;;15,283159;15,332021;0,048862;;0,047445;0,001417;-0,046028
209;15.332.021;23,36,252,159;192,168,43,84;TCP;54;443  >  57203 [ACK] Seq=1 Ack=195 Win=30336 Len=0;;15,332021;15,333438;0,001417;;-0,007579;0,008996;0,016575
210;15.333.438;23,36,252,159;192,168,43,84;TLSv1,2;1434;Server Hello;;15,333438;15,342434;0,008996;;0,008855;0,000141;-0,008714
211;15.342.434;23,36,252,159;192,168,43,84;TCP;1434;443  >  57203 [ACK] Seq=1381 Ack=195 Win=30336 Len=1380 [TCP segment of a reassembled PDU];;15,342434;15,342575;0,000141;;2,00E-06;0,000139;0,000137
212;15.342.575;192,168,43,84;23,36,252,159;TCP;54;57203  >  443 [ACK] Seq=195 Ack=2761 Win=131072 Len=0;;15,342575;15,342714;0,000139;;-0,001881;0,00202;0,003901
213;15.342.714;23,36,252,159;192,168,43,84;TLSv1,2;998;Certificate, Certificate Status, Server Key Exchange, Server Hello Done;;15,342714;15,344734;0,00202;;-0,100244;0,102264;0,202508
214;15.344.734;192,168,43,84;23,36,252,159;TLSv1,2;180;Client Key Exchange, Change Cipher Spec, Encrypted Handshake Message;;15,344734;15,446998;0,102264;;0,099763;0,002501;-0,097262
215;15.446.998;23,36,252,159;192,168,43,84;TLSv1,2;312;New Session Ticket, Change Cipher Spec, Encrypted Handshake Message;;15,446998;15,449499;0,002501;;0,002315;0,000186;-0,002129
216;15.449.499;192,168,43,84;23,36,252,159;TLSv1,2;141;Application Data;;15,449499;15,449685;0,000186;;-0,006799;0,006985;0,013784
217;15.449.685;192,168,43,84;23,36,252,159;TLSv1,2;168;Application Data;;15,449685;15,45667;0,006985;;0,00674;0,000245;-0,006495
218;15.456.670;192,168,43,84;161,69,38,37;TCP;54;57201  >  443 [RST, ACK] Seq=3914 Ack=5656 Win=0 Len=0;;15,45667;15,456915;0,000245;;0,000225;2,00E-05;-0,000205
219;15.456.915;192,168,43,84;204,246,164,57;TCP;55;56936  >  443 [ACK] Seq=1 Ack=1 Win=512 Len=1 [TCP segment of a reassembled PDU];;15,456915;15,456935;2,00E-05;;-0,061871;0,061891;0,123762
220;15.456.935;192,168,43,84;161,69,38,82;TCP;54;57202  >  443 [RST, ACK] Seq=3934 Ack=5488 Win=0 Len=0;;15,456935;15,518826;0,061891;;0,026466;0,035425;0,008959
221;15.518.826;204,246,164,57;192,168,43,84;TCP;66;443  >  56936 [ACK] Seq=1 Ack=2 Win=144 Len=0 SLE=1 SRE=2;;15,518826;15,554251;0,035425;;0,025081;0,010344;-0,014737
222;15.554.251;23,36,252,159;192,168,43,84;TCP;54;443  >  57203 [ACK] Seq=3963 Ack=522 Win=30336 Len=0;;15,554251;15,564595;0,010344;;0,010194;0,00015;-0,010044
223;15.564.595;23,36,252,159;192,168,43,84;TLSv1,2;259;Application Data;;15,564595;15,564745;0,00015;;-0,067871;0,068021;0,135892
224;15.564.745;192,168,43,84;23,36,252,159;TLSv1,2;92;Application Data;;15,564745;15,632766;0,068021;;0,012395;0,055626;0,043231
227;15.632.766;192,168,43,84;161,69,38,37;TCP;66;57204  >  80 [SYN] Seq=0 Win=64240 Len=0 MSS=1460 WS=256 SACK_PERM=1;;15,632766;15,688392;0,055626;;-0,151062;0,206688;0,35775
228;15.688.392;23,36,252,159;192,168,43,84;TCP;54;443  >  57203 [ACK] Seq=4168 Ack=560 Win=30336 Len=0;;15,688392;15,89508;0,206688;;0,206585;0,000103;-0,206482
229;15.895.080;161,69,38,37;192,168,43,84;TCP;66;80  >  57204 [SYN, ACK] Seq=0 Ack=1 Win=65535 Len=0 MSS=1380 WS=1024 SACK_PERM=1;;15,89508;15,895183;0,000103;;9,20E-05;1,10E-05;-8,10E-05
230;15.895.183;192,168,43,84;161,69,38,37;TCP;54;57204  >  80 [ACK] Seq=1 Ack=1 Win=131072 Len=0;;15,895183;15,895194;1,10E-05;;-0,26343;0,263441;0,526871
231;15.895.194;192,168,43,84;161,69,38,37;TCP;54;57204  >  80 [FIN, ACK] Seq=1 Ack=1 Win=131072 Len=0;;15,895194;16,158635;0,263441;;0,263296;0,000145;-0,263151
232;16.158.635;161,69,38,37;192,168,43,84;TCP;54;80  >  57204 [ACK] Seq=1 Ack=4294967294 Win=64512 Len=0;;16,158635;16,15878;0,000145;;0,000145;0;-0,000145
233;16.158.780;161,69,38,37;192,168,43,84;TCP;54;80  >  57204 [ACK] Seq=1 Ack=4294967295 Win=64512 Len=0;;16,15878;16,15878;0;;0;0;0
234;16.158.780;161,69,38,37;192,168,43,84;TCP;54;80  >  57204 [ACK] Seq=1 Ack=0 Win=64512 Len=0;;16,15878;16,15878;0;;0;0;0
235;16.158.780;161,69,38,37;192,168,43,84;TCP;54;80  >  57204 [ACK] Seq=1 Ack=1 Win=64512 Len=0;;16,15878;16,15878;0;;-9,90E-05;9,90E-05;0,000198
236;16.158.780;161,69,38,37;192,168,43,84;TCP;54;80  >  57204 [ACK] Seq=1 Ack=2 Win=64512 Len=0;;16,15878;16,158879;9,90E-05;;6,90E-05;3,00E-05;-3,90E-05
237;16.158.879;161,69,38,37;192,168,43,84;TCP;54;80  >  57204 [FIN, ACK] Seq=1 Ack=2 Win=64512 Len=0;;16,158879;16,158909;3,00E-05;;-0,326051;0,326081;0,652132
238;16.158.909;192,168,43,84;161,69,38,37;TCP;54;57204  >  80 [ACK] Seq=2 Ack=2 Win=131072 Len=0;;16,158909;16,48499;0,326081;;0,286942;0,039139;-0,247803
239;16.484.990;192,168,43,84;184,72,128,137;TCP;55;[TCP Keep-Alive] 56880  >  443 [ACK] Seq=1 Ack=1 Win=64666 Len=1;;16,48499;16,524129;0,039139;;-0,205379;0,244518;0,449897
240;16.524.129;192,168,43,84;161,69,38,37;TCP;66;57205  >  80 [SYN] Seq=0 Win=64240 Len=0 MSS=1460 WS=256 SACK_PERM=1;;16,524129;16,768647;0,244518;;0,244445;7,30E-05;-0,244372
242;16.768.647;161,69,38,37;192,168,43,84;TCP;66;80  >  57205 [SYN, ACK] Seq=0 Ack=1 Win=65535 Len=0 MSS=1380 WS=1024 SACK_PERM=1;;16,768647;16,76872;7,30E-05;;1,00E-05;6,30E-05;5,30E-05
243;16.768.720;192,168,43,84;161,69,38,37;TCP;54;57205  >  80 [ACK] Seq=1 Ack=1 Win=131072 Len=0;;16,76872;16,768783;6,30E-05;;-0,00425;0,004313;0,008563
244;16.768.783;192,168,43,84;161,69,38,37;TCP;54;57205  >  80 [FIN, ACK] Seq=1 Ack=1 Win=131072 Len=0;;16,768783;16,773096;0,004313;;-0,027407;0,03172;0,059127
245;16.773.096;184,72,128,137;192,168,43,84;TCP;54;[TCP Keep-Alive ACK] 443  >  56880 [ACK] Seq=1 Ack=2 Win=35880 Len=0;;16,773096;16,804816;0,03172;;0,031718;2,00E-06;-0,031716
247;16.804.816;192,168,43,84;161,69,49,20;TCP;66;57206  >  443 [SYN] Seq=0 Win=65535 Len=0 MSS=1460 WS=256 SACK_PERM=1;;16,804816;16,804818;2,00E-06;;-0,213833;0,213835;0,427668
248;16.804.818;192,168,43,84;161,69,49,20;TCP;66;57207  >  443 [SYN] Seq=0 Win=65535 Len=0 MSS=1460 WS=256 SACK_PERM=1;;16,804818;17,018653;0,213835;;0,21371;0,000125;-0,213585
249;17.018.653;161,69,38,37;192,168,43,84;TCP;54;80  >  57205 [ACK] Seq=1 Ack=4294967294 Win=64512 Len=0;;17,018653;17,018778;0,000125;;0,000125;0;-0,000125
250;17.018.778;161,69,38,37;192,168,43,84;TCP;54;80  >  57205 [ACK] Seq=1 Ack=4294967295 Win=64512 Len=0;;17,018778;17,018778;0;;0;0;0
251;17.018.778;161,69,38,37;192,168,43,84;TCP;54;80  >  57205 [ACK] Seq=1 Ack=0 Win=64512 Len=0;;17,018778;17,018778;0;;0;0;0
252;17.018.778;161,69,38,37;192,168,43,84;TCP;54;80  >  57205 [ACK] Seq=1 Ack=1 Win=64512 Len=0;;17,018778;17,018778;0;;-8,10E-05;8,10E-05;0,000162
253;17.018.778;161,69,38,37;192,168,43,84;TCP;54;80  >  57205 [ACK] Seq=1 Ack=2 Win=64512 Len=0;;17,018778;17,018859;8,10E-05;;1,80E-05;6,30E-05;4,50E-05
254;17.018.859;161,69,38,37;192,168,43,84;TCP;54;80  >  57205 [FIN, ACK] Seq=1 Ack=2 Win=64512 Len=0;;17,018859;17,018922;6,30E-05;;-0,070679;0,070742;0,141421
255;17.018.922;192,168,43,84;161,69,38,37;TCP;54;57205  >  80 [ACK] Seq=2 Ack=2 Win=131072 Len=0;;17,018922;17,089664;0,070742;;0,07063;0,000112;-0,070518
256;17.089.664;161,69,49,20;192,168,43,84;TCP;66;443  >  57207 [SYN, ACK] Seq=0 Ack=1 Win=65535 Len=0 MSS=1380 WS=1024 SACK_PERM=1;;17,089664;17,089776;0,000112;;-0,001518;0,00163;0,003148
257;17.089.776;192,168,43,84;161,69,49,20;TCP;54;57207  >  443 [ACK] Seq=1 Ack=1 Win=262144 Len=0;;17,089776;17,091406;0,00163;;0,000691;0,000939;0,000248
258;17.091.406;192,168,43,84;161,69,49,20;TLSv1,2;228;Client Hello;;17,091406;17,092345;0,000939;;0,000807;0,000132;-0,000675
